Category,Title
Strategy and Management,The Logic of Joint Research and Development
Strategy and Management,Responsible Leadership and Corporate Social Responsibility:
Strategy and Management,Looking Back at Topeka: General Foods and the Quality-of-Work-Life Experiment
Strategy and Management,Strategy search and creativity: The key to corporate renewal
Strategy and Management,The Politics of Forecasting: Managing the Truth
Strategy and Management,The Export Trading Company Act: A Viable International Marketing Tool
Strategy and Management,Managing Organizational Transformations: Lessons from the Veterans Health Administration
Strategy and Management,Creating and Managing Joint Ventures in China
Strategy and Management,Why Incumbents Struggle to Extract Value from New Strategic Options:
Strategy and Management,Work and Leisure in Japan
Strategy and Management,Reforming Corporate Governance
Strategy and Management,Pan-European groupings: A case study in paint manufacture
Strategy and Management,Errata: Racial Factors in Site Location and Employment Patterns of Japanese Auto Firms in America
Strategy and Management,EIASM workshop on corporate finance and the stock market
Strategy and Management,Business Entertainment and its Motivation Tax Problem
Strategy and Management,Dynamics of Core Competencies in Leading Multinational Companies
Strategy and Management,Management Featherbeds Revisited
Strategy and Management,A framework for analyzing service operations
Strategy and Management,A pragmatic approach to business ethics
Strategy and Management,Why and How to Diversify
Strategy and Management,Cases in environmental management and business strategy
Strategy and Management,Business and its Managers in Africa
Strategy and Management,Japanese-Style Management in America
Strategy and Management,Successful customer value management: Key lessons and emerging trends
Strategy and Management,Future Trends in the Struggle for Control of International Oil Resources
Strategy and Management,Perceived competitive influences and innovative behaviour
Strategy and Management,Is the “Skills Gap” Really about Attitudes?
Strategy and Management,How can the subjective well-being of nurses be predicted? Understanding the mediating effect of psychological distress  psychological resilience and emotional exhaustion
Strategy and Management,Changing Aspects of U.S. Economic Growth
Strategy and Management,The Real Cost of M&amp;A Advice
Strategy and Management,Demon: A Management Model for Marketing New Products
Strategy and Management,Rare Mettle: Gold and Silver Strategies to Succeed in Hostile Markets
Strategy and Management,Customer value cocreation activities
Strategy and Management,Organizational Ambidexterity in Action: How Managers Explore and Exploit
Strategy and Management,Japanese Telecommunications: Reforms and Trade Implications
Strategy and Management,Employee Performance and Employee Need Satisfaction—Which Comes First?
Strategy and Management,Commitment and competence in solving work performance problems
Strategy and Management,Executives under Fire: The Burnout Syndrome
Strategy and Management,An Alternative Approach to Auto Emission Control
Strategy and Management,Socioemotional wealth in family business research: A systematic literature review on its definition  roles and dimensions
Strategy and Management,How social media practices shape family business performance: The wine industry case study
Strategy and Management,Overcoming Barriers to Entry in an Established Industry: Tesla Motors
Strategy and Management,The Risk of De-Risking Innovation: Optimal R&amp;D Strategies in Ambiguous Environments
Strategy and Management,Corporate Strategy:<i>A Point of View</i>
Strategy and Management,New Product Blockbusters: The Magic and Science of Prediction Markets
Strategy and Management,Open Innovation for Wicked Problems: Using Proximity to Overcome Barriers
Strategy and Management,The beginning of value co-creation: understanding dynamics  efforts and betterment
Strategy and Management,Detours in the Path toward Strategic Information Systems Alignment
Strategy and Management,Dilemmas of Appraisal
Strategy and Management,ESOPs: Panacea or Placebo?
Strategy and Management,About the authors
Strategy and Management,International financial controllers' conference
Strategy and Management,Clarifying Responsibility Relationships
Strategy and Management,Origins and Careers of American Business  Government and Academic Elites
Strategy and Management,Conflicts between Host Countries and the Multinational Enterprise
Strategy and Management,Latin American Management Education and Recruitment: An Environmental Perspective
Strategy and Management,The Consumer Product Safety Commission
Strategy and Management,A Stochastic Model for Human Resources Valuation
Strategy and Management,Building and Maintaining Strategic Agility: An Agenda and Framework for Executive IT leaders
Strategy and Management,Electric Vehicles Are a Platform Business: What Firms Need to Know
Strategy and Management,Integrating the Strategy Formation Process:
Strategy and Management,The Theory of Financial Leverage and Conglomerate Mergers
Strategy and Management,Is Your Project Turning into a Black Hole?
Strategy and Management,Engaging leader – Engaged employees? A cross-lagged study on employee engagement
Strategy and Management,The Board of Directors: Legalistic Anachronism or Vital Force
Strategy and Management,On the Complexity of Managing Transparency
Strategy and Management,The increasing importance of public marketing: Explanations  applications and limits of marketing within public administration
Strategy and Management,Dependence and uncertainty in broker strategies of research intermediaries
Strategy and Management,Organizational injustice and employee affective health: The moderating effects of labor market conditions
Strategy and Management,In the Name of Profit Robert Heilbroner
Strategy and Management,Leaders as change executors: The impact of leader attitudes to change and change-specific support on followers
Strategy and Management,CEO self-discipline in power use: A key moderator for the effect of CEO power
Strategy and Management,Product plus: How product + service = competitive advantage
Strategy and Management,Interaction effects of media and message on perceived complexity  risk and trust of innovative products
Strategy and Management,The mutual influence of Environmental Management Systems and the EU ETS: Findings for the Italian pulp and paper industry
Strategy and Management,Pension Plans vs. Mutual Funds: Is the Client Victim or Culprit?
Strategy and Management,LDC Governments: Takeovers and Renegotiations of Foreign Investments
Strategy and Management,The role of social capital and culture on social decision-making constraints: A multilevel investigation
Strategy and Management,Specialized organizations and ambidextrous clusters in the open innovation paradigm
Strategy and Management,Cross-level effect of resonant leadership on remote engagement: A moderated mediation analysis in the unprecedented COVID-19 crisis
Strategy and Management,Abstract: Fresh Starts: Arnold Cooper on Entrepreneurship and Wealth Creation
Strategy and Management,Outcome-based contracts as a driver for systems thinking and service-dominant logic in service science: Evidence from the defence industry
Strategy and Management,Biographies for Crosstalk
Strategy and Management,The Search for Industry: Identifying Regional Manufacturing Opportunities
Strategy and Management,Contents for: 22/3
Strategy and Management,Avoiding Managerial Obsolescence
Strategy and Management,Mastering Balance: How to Meet and Beat a Stronger Opponent
Strategy and Management,Chez Panisse: Building an Open Innovation Ecosystem
Strategy and Management,The Business Value of Gamification
Strategy and Management,Economic Policy Problems Facing the New Administration
Strategy and Management,The impact of organisational politics and trust in the top management team on strategic decision implementation success: A middle-manager's perspective
Strategy and Management,Who’s <i>Really</i> Doing the Work? The Impact of Group Size on Over-Claiming of Responsibility
Strategy and Management,Precepts for Managers—Interviews with Chester I. Barnard
Strategy and Management,The role of health locus of control in value co-creation for standardized screening services
Strategy and Management,Organizational justice and personal initiative  mediating role of affective commitment
Strategy and Management,The Enterprise at the Edge:
Strategy and Management,Achieving and Sustaining Business-IT Alignment
Strategy and Management,On transformation and adaptation: Building the entrepreneurial corporation
Strategy and Management,How does acquisition experience create value? Evidence from a regulatory change affecting the information environment
Strategy and Management,Strategic industrial marketing
Strategy and Management,The development needs of Australian Company directors
Strategy and Management,Linear Organization Charts
Strategy and Management,Continuous Quality Improvement as a Survival Strategy: The Southern Pacific Experience
Strategy and Management,Professional Norms and Organizational Goals: An Illusory Dichotomy
Strategy and Management,The acquisition and integration of Zanussi by Electrolux : A case study
Strategy and Management,The dynamics and effectiveness of international joint ventures
Strategy and Management,Manpower Developments and Requirements in Our New Service Economy
Strategy and Management,Leadership in a Declining Work Ethic
Strategy and Management,Managing Organizational Conflict
Strategy and Management,Role Conflict and Multiple Authority in Complex Organizations
Strategy and Management,Internet-Based Entrepreneurial Finance: Lessons from Germany
Strategy and Management,Specialization and the MBA: Is the Broad MBA Passé?
Strategy and Management,Market valuation of European bank mergers
Strategy and Management,Advance Selling for Services
Strategy and Management,High technology in the service industries: Its direct impact on the consumer
Strategy and Management,The Role of the Assistant: A Modern Business Enigma
Strategy and Management,Nokia and Strategic Agility: A Postscript
Strategy and Management,Radical strategies for profitable growth
Strategy and Management,Engagement  satisfaction and customer behavior-based CRM performance
Strategy and Management,Enabling Customization Using Standardized Operations
Strategy and Management,Human resources management and corporate governance: Integration perspectives and future directions
Strategy and Management,Excellence management practices  knowledge management and key business results in large organisations and SMEs: A multi-group analysis
Strategy and Management,Strategic Issues and Local Constraints in Transnational Compensation Strategies:
Strategy and Management,A multi-layered approach to CRM implementation: An integration perspective
Strategy and Management,Critical Competencies in Virtual Service Webs
Strategy and Management,Integrating Social Responsibility and Marketing Strategy: An Introduction
Strategy and Management,Strategic planning in a regulated trade bloc: The pharmaceutical industry in the European union
Strategy and Management,China: Management in time of change
Strategy and Management,1992: A regional impact
Strategy and Management,Guidelines for Social Return on Investment
Strategy and Management,Riding the Russian Roller Coaster: U.S. Firms' Recent Experience and Future Plans in the Former USSR
Strategy and Management,Managerial Career Development and the Generational Confrontation
Strategy and Management,Extending Open Innovation: Orchestrating Knowledge Flows from Corporate Venture Capital Investments
Strategy and Management,Management's Role in Declining Productivity
Strategy and Management,A systematic literature review on transformative practices and well-being outcomes in healthcare service
Strategy and Management,Strategic learning with scenarios
Strategy and Management,Political orientation and perceived quality of television channels
Strategy and Management,The Canton Trade Fair  1976
Strategy and Management,Protecting Growth Options in Dynamic Markets: The Role of Strategic Disclosure in Integrated Intellectual Property Strategies
Strategy and Management,The Management of Manufacturing Flexibility
Strategy and Management,Consumer delight and outrage: scale development and validation
Strategy and Management,Managing the Effects of Layoffs on Survivors
Strategy and Management,Overcoming the Perils of Advocacy in Corporate Planning
Strategy and Management,Switzerland and Europe 1992 — Strategy of an outsider
Strategy and Management,Some implications of the growth dimension in corporate planning
Strategy and Management,Reply: Premature Reports of Demise
Strategy and Management,Investing in the right technology for corporate success
Strategy and Management,Meeting the Threat of Managerial Obsolescence
Strategy and Management,Dualities of digital services: everyday digital services as positive and negative contributors to customer well-being
Strategy and Management,The Sophisticated Swedish Tax Policy
Strategy and Management,The Sales Force Management Audit
Strategy and Management,“Five Styles of Strategy Innovation and How to use Them” by Pierre Loewe  Peter Williamson and Robert Chapman Wood. European Journal of Management 19(2) pp. 115–125
Strategy and Management,Core Objectives: Clarity in Designing Strategy
Strategy and Management,Activating multiple roles of customer-firm relationships in service failures
Strategy and Management,Culture  value commitments  and supervisors’ ethics: Exploring a multilevel mediation model
Strategy and Management,Avoiding the Pitfalls of Overconfidence While Benefiting from the Advantages of Confidence
Strategy and Management,Recent Developments in the Savings and Loan Industry
Strategy and Management,Organizational diagnosis in practice: a cross-classification analysis using the DEL-technique
Strategy and Management,Developing Organisational Change Capability
Strategy and Management,The Emergence of Free Market Retailing in the People's Republic of China: Promises and Consequences
Strategy and Management,Pro-innovation culture  ambidexterity and new product development performance: Polynomial regression and response surface analysis
Strategy and Management,New Challenges for European Human Resource Management. Chris Brewster  Wolfgang Mayrhofer and Michael Morley (eds). Macmillan: Houndmills. 2000. ISBN 0-333-74965-0
Strategy and Management,Reconciling Management Research and Practice
Strategy and Management,Monetizing disinformation in the attention economy: The case of genetically modified organisms (GMOs)
Strategy and Management,The Role of the Consumer in Image Building
Strategy and Management,Consumer Discontent: A Social Perspective
Strategy and Management,Closing the Gap in an Interdependent World
Strategy and Management,Clarifying Responsibility Relationships
Strategy and Management,It evaluation: Managing the catch 22
Strategy and Management,The hostile takeover process:
Strategy and Management,What is Appropriate Public Policy for Profit Renegotiation?
Strategy and Management,A skill-based approach to human resource management
Strategy and Management,Social Capital and Capital Gains in Silicon Valley
Strategy and Management,The Strategy Concept II: Another Look at Why Organizations Need Strategies
Strategy and Management,How does training improve customer service quality? The roles of transfer of training and job satisfaction
Strategy and Management,Book Review: Taking Mayo and McGregor Seriously
Strategy and Management,The positive outcomes of ‘Socially Sharing Negative Emotions’ in workteams: A conceptual exploration
Strategy and Management,Introducing a Circular Economy: New Thinking with New Managerial and Policy Implications
Strategy and Management,Ethical and Legal Aspects of Managing Corporate Cultures
Strategy and Management,Japanese technological advance: Problems of evaluation
Strategy and Management,Management Half-Truths and Nonsense: How to Practice Evidence-Based Management
Strategy and Management,A New Approach to Design and Use of Management Information
Strategy and Management,Delivering Desired Outcomes Efficiently: The Creative Key to Competitive Strategy
Strategy and Management,Leaders who make a difference
Strategy and Management,Designing a Dual Marketing Program
Strategy and Management,Information technology and product policy: ‘Smart’ products
Strategy and Management,Scanning the International Environment
Strategy and Management,Approaching management and organization paradoxes paradoxically: The case for the tetralemma as an expansive encasement strategy
Strategy and Management,Whatever happened at barings? Part two: Unauthorised trading and the failure of controls
Strategy and Management,Financial Motives of U.S. Corporate Investment in Korea
Strategy and Management,Editorial: The year of the small and medium-sized enterprise
Strategy and Management,Digital transformation: A review and research agenda
Strategy and Management,Beyond Employment  Alain Supiot (2001)  Oxford University Press  Oxford  245 pp  ISBN 0-19-924304-2 (£15.99)
Strategy and Management,The FTC—Large Quality Store Advertising and the Small Retailer
Strategy and Management,Implementing Job Enrichment
Strategy and Management,Gaining competitive advantage through customer satisfaction
Strategy and Management,Human resource management in European banking: Challenges and responses
Strategy and Management,Culture Change at Genentech: Accelerating Strategic and Financial Accomplishments
Strategy and Management,International Trade and the Common Market
Strategy and Management,Are Ex-Offenders Successful Employees?
Strategy and Management,Role Conflict  General Manager Job Satisfaction and Stress and the Performance of IJVs
Strategy and Management,Knowledge Sharing in an Emerging Network of Practice:
Strategy and Management,From start to finish: Flexi-time as a social exchange and its impact on organizational outcomes
Strategy and Management,Understanding the Performance Drivers of Conscious Firms
Strategy and Management,How Social Entrepreneurs Zig-Zag Their Way to Impact at Scale
Strategy and Management,Who’s <i>Really</i> Doing the Work? The Impact of Group Size on Over-Claiming of Responsibility
Strategy and Management,Drivers and mechanisms for online communities performance: A systematic literature review
Strategy and Management,Guest editorial: Collaborating and sharing with AI: a research agenda
Strategy and Management,Patagonia: Driving Sustainable Innovation by Embracing Tensions
Strategy and Management,Share and Share Alike: <scp>How Inner Source Can Help Create New Digital Platforms</scp>
Strategy and Management,Problems of Economic Growth and Automation
Strategy and Management,Corporate strategy: Some lessons from consultancy
Strategy and Management,THE ONE FOOT SHELF—Consumer Behavior
Strategy and Management,Large shareholders and value creation through corporate acquisitions in Europe. The identity of the controlling shareholder matters
Strategy and Management,Art  Philosophy  and Business: turns to speculative realism in European management scholarship
Strategy and Management,‘Employees response to corporate social responsibility: Exploring the role of employees’ collectivist orientation’
Strategy and Management,Buy-outs in Germany
Strategy and Management,Dynamic Capabilities at Samsung: Optimizing Internal Co-Opetition
Strategy and Management,Managing managers in Europe
Strategy and Management,Updating Impressions of the Military-Industry Complex
Strategy and Management,Learning by giving-and-taking: Two-way knowledge transfer between core and periphery
Strategy and Management,Integrating Public Affairs and Strategic Planning
Strategy and Management,Negotiating Venture Capital Financing
Strategy and Management,The learning organization
Strategy and Management,Reading between the lines: Learning as a process between organizational context and individuals’ proclivities
Strategy and Management,Reconsidering outsourcing solutions
Strategy and Management,Risk and value at risk
Strategy and Management,CMR Classics: Speed and Strategic Choice: How Managers Accelerate Decision Making
Strategy and Management,Relationship between boardroom independence and corporate performance: Reflections and perspectives
Strategy and Management,Communications from Readers
Strategy and Management,The Rearranged Work Week
Strategy and Management,Contents for 23/04
Strategy and Management,Managerial and Organizational Cognition: Implications for Business and Management in Europe
Strategy and Management,Organizations: New Concepts for New Forms
Strategy and Management,We are not who they think we are! Examining responses of qualified Tunisian immigrants in France to country-of-origin based image discrepancies
Strategy and Management,Managing Value in Supply Chains: Case Studies on the Sourcing Hub Concept
Strategy and Management,Retail Inventory: Managing the Canary in the Coal Mine
Strategy and Management,Regulatory Uncertainty and Opportunity Seeking: The Case of Clean Development
Strategy and Management,Logical Incrementalism as a Path to Strategic Agility: T<scp>he</scp> C<scp>ase</scp><scp>of</scp> NASA
Strategy and Management,Consumerism &amp; Business
Strategy and Management,Depth Analysis of Organizational Life
Strategy and Management,When Work Becomes Home and Home Becomes Work
Strategy and Management,Logistics and procurement outsourcing in the healthcare sector: A comparative analysis
Strategy and Management,Designing Governance Mechanisms in Platform Ecosystems: Addressing the Paradox of Openness through Blockchain Technology
Strategy and Management,The future for strategy: An interview with Gary Hamel
Strategy and Management,How to zig in a zagging world — Unleashing your hidden creativity
Strategy and Management,European casebook on business ethics
Strategy and Management,Continuing Education and the Experienced Manager
Strategy and Management,Man and His Work
Strategy and Management,Creating Organizational Order Out of Chaos: Self-Renewal in Japanese Firms
Strategy and Management,Smart Cities at the Crossroads
Strategy and Management,Why organisations need humour
Strategy and Management,Economic Interdependence and the International Corporation
Strategy and Management,Cutting the Strategy Diamond in High-Technology Ventures
Strategy and Management,The impact of brand equity on employee attitudes
Strategy and Management,Merchandising in Department Store Chains
Strategy and Management,The Future of Investment in Real Estate
Strategy and Management,The Development Paths of Non-Strategic Capabilities
Strategy and Management,Executives and Sales Aptitude Testing
Strategy and Management,Myths about Diversity: What Managers Need to Know about Changes in the U.S. Labor Force
Strategy and Management,Orchestrating Human-Machine Designer Ensembles during Product Innovation
Strategy and Management,Business processes: Modelling &amp; analysis for re-engineering and improvement
Strategy and Management,Why Improving Quality Doesn't Improve Quality (or Whatever Happened to Marketing?)
Strategy and Management,Aligning Supply Chain Strategies with Product Uncertainties
Strategy and Management,Power and dependence perspectives on outsourcing decisions
Strategy and Management,Understanding the impact of internal marketing practices on both employees
Strategy and Management,Air Pollution Control: The Case of Los Angeles County
Strategy and Management,Expansion-oriented job crafting and employee performance: A self-empowerment perspective
Strategy and Management,Structural and Organizational Issues in Patient Safety: A Comparison of Health Care to other High-Hazard Industries
Strategy and Management,Measuring the Knower: Towards a Theory of Knowledge Equity
Strategy and Management,Is Revenue Sharing Right for Your Supply Chain?
Strategy and Management,Value Creation Architectures and Competitive Advantage: Lessons from the European Automobile Industry
Strategy and Management,The Public's Trust in Nonprofit Organizations: The Role of Relationship Marketing and Management
Strategy and Management,Living with zombie companies: Do we know where the threat lies?
Strategy and Management,Implementing intra-organizational learning:
Strategy and Management,Artificial Intelligence in Human Resources Management: Challenges and a Path Forward
Strategy and Management,Did small and medium enterprises maintain better jobs during the early years of the recession? Job quality multidimensional evidence from Spain
Strategy and Management,Reviewer Acknowledgement 2021
Strategy and Management,Aligning Identity and Strategy: Corporate Branding at British Airways in the Late 20th Century
Strategy and Management,Top management team and board of directors as the strategic leadership system: The effect of behavioral integration on strategic decision-making quality
Strategy and Management,From the President of the University of California  Clark Kerr
Strategy and Management,Fine Arts: A Problem in Risk Management
Strategy and Management,Computers  Modeling  and Management Education
Strategy and Management,Crisis Management and Environmentalism: A Natural Fit
Strategy and Management,Patagonia: Driving Sustainable Innovation by Embracing Tensions
Strategy and Management,A Political Role for Business
Strategy and Management,When Ethics Travel: The Promise and Peril of Global Business Ethics
Strategy and Management,Facilitators and inhibitors of value co-creation in the industrial services environment
Strategy and Management,Revolution Foods: Expansion into the CPG Market
Strategy and Management,Organizing a Strategic Information Scanning System
