Category,Title
Marketing,Clockwise versus counterclockwise turning bias: Moderation effects of foot traffic and cognitive experience on visual attention
Marketing,Effective advertising in industrial supplier directories
Marketing,Evolution of FDI in the United States in the context of trade liberalization and regionalization
Marketing,Virtual shopping agents
Marketing,Is Industrial Advertising Still Sexist
Marketing,The effect of leader–member exchange on turnover among retail buyers
Marketing,Understanding consumer repurchase intentions towards luxury retail brands: Evidence from an emerging market
Marketing,Consumer perceptions of refund depth and competitive scope in price-matching guarantees: effects on store patronage
Marketing,The effect of start/end temporal landmarks on consumers' visual attention and judgments
Marketing,How fine is C-OAR-SE? A generalizability theory perspective on Rossiter's procedure
Marketing,Postal surveys to small manufacturers
Marketing,Customer pressure  customer–manufacturer–supplier relationships  and quality control performance
Marketing,Viability of Amazon’s driven innovations targeting shoppers’ impulsiveness
Marketing,Customer Acceptance: The Key to Successful Introductions of Innovations
Marketing,Exploring the role of international R&amp;D activities in the impact of technological and marketing capabilities on SMEs’ performance
Marketing,Organizing for solutions: How project-based firms integrate project and service businesses
Marketing,The CAN-SPAM Act: New rules for sending commercial e-mail messages and implications for the sales force
Marketing,Consumers' preference for eco-friendly packaged products: pride vs guilt appeal
Marketing,An exploratory investigation of the interdependence between marketing and operations functions in service firms
Marketing,Do Celebrity Endorsements Benefit Familiar Luxury Brands? A Perspective From Social Adaptation Theory
Marketing,The rise of emerging market multinationals and the impact on marketing
Marketing,Controlling the commercialisation of science across inter-organisational borders: Four cases from two major Swedish universities
Marketing,The importance of being earnest: Mandatory vs. voluntary disclosure of incentives for online product reviews
Marketing,Sharing is the name of the game: Exploring the role of social media communication practices on B2B customer relationships in the life sciences industry
Marketing,Use of human judgment models in industrial buyers' vendor selection decisions
Marketing,Brand strategy needs turning back to front
Marketing,Retail bank marketing in Western Australia
Marketing,Tales from the countryside: Unpacking “passing the environmental buck” as hypocritical practice in the food supply chain
Marketing,The effect of emotional provider support on angry versus anxious consumers
Marketing,Themed flagship brand stores in the new millennium
Marketing,Power priorities in buyer–seller relationships: A comparative analysis
Marketing,Dissecting the visiting willingness of driving visitors facing a retail market's dual-pricing policy for parking
Marketing,The differentiated impact of perceived brand competence type on brand extension evaluation
Marketing,Long-term relationship in industrial marketing: Reality or rhetoric?
Marketing,Is your doctorate really necessary?
Marketing,Satisfaction and the result of the delivery channels of domestic electronic products
Marketing,Characteristics of early adopters in mobile communications markets
Marketing,Strategies  technologies  and organizational learning for developing organizational innovativeness in emerging economies
Marketing,Do top management teams’ expectations and support drive management innovation in small and medium-sized enterprises?
Marketing,The effect of experiential learning on subsidiary knowledge and performance
Marketing,Evaluating retail format extensions: The role of shopping goals
Marketing,Gen Y consumers' brand loyalty: a brand romance perspective
Marketing,Return freight strategies and selling formats in e-commerce supply chain: The perspective of consumer fairness concerns and online shopping returns
Marketing,Measuring the Impact of Price Guarantees on Bidding in Consumer Online Auctions
Marketing,Do small businesses have to practise marketing to survive and grow?
Marketing,Relationship hindrance: why would consumers not want a relationship with a retailer?
Marketing,A dynamic model of the advertising-price sensitivity relationship for heterogeneous consumers
Marketing,Meeting the information needs of marketing in the twenty‐first century
Marketing,Increasing productivity through performance appraisal
Marketing,Marketing strategies for services: Globalization  client-orientation  de-regulation
Marketing,Consumer rights or unethical behaviors: Exploring the impacts of retailer return policies
Marketing,Who is more likely to initiate referrals? Effect of consumer's regulatory focus on referral intention
Marketing,WITHDRAWN: Customer involvement and perceptions: The moderating role of customer co-production
Marketing,Beyond form and function: Why do consumers value product design?
Marketing,Image  performance  attitudes  trust  and loyalty in financial services
Marketing,When and How Multitasking Impacts Consumer Shopping Decisions
Marketing,The PLS agent: Predictive modeling with PLS-SEM and agent-based simulation
Marketing,Introduction to the Special Section: Research for the New Normal
Marketing,Digital economy: An innovation driver for total factor productivity
Marketing,The ivory tower and the street: How researchers defined country image over four decades and what consumers think it means
Marketing,Purchasing's role in computer buying: A comparative study
Marketing,Emotion and advertising effectiveness: A novel facial expression analysis approach
Marketing,Reverse logistics  stakeholders' influence  organizational slack  and managers' posture
Marketing,The role of etail quality  e-satisfaction and e-trust in online loyalty development process
Marketing,Consumer response to retailer use of cause-related marketing: Is more fit better?
Marketing,Meme marketing effectiveness: A moderated-mediation model
Marketing,A kaleidoscope of business network dynamics: Rotating process theories to reveal network microfoundations
Marketing,Service inside: The impact of ingredient service branding on quality perceptions and behavioral intentions
Marketing,Risk perception and risk avoidance: The role of cultural identity and personal relevance
Marketing,Negative online brand engagement: conceptualisation  scale development and validation
Marketing,Effects of service setting and other consumers’ age on the service perceptions of young consumers
Marketing,Fitting strategic resources with product-market strategy: Performance implications
Marketing,Reducing food waste and food insecurity in the UK: The architecture of surplus food distribution supply chain in addressing the sustainable development goals (Goal 2 and Goal 12.3) at a city level
Marketing,“You Lost Me at Hello”: How and when accent-based biases are expressed and suppressed
Marketing,Perceived service innovativeness  consumer trait innovativeness and patronage intention
Marketing,Special issue on retailing research from the Nordic countries
Marketing,Marketing Private Banking Services to Family Businesses
Marketing,Mandatory Calorie Disclosure: A Comprehensive Analysis of Its Effect on Consumers and Retailers
Marketing,Product form bundling: Implications for marketing digital products
Marketing,Perceptions of relationship marketing among account managers of commercial banks in a Chinese environment
Marketing,The management of marketing
Marketing,Do shoppers choose the same brand on the next trip when facing the same context? An empirical investigation in FMCG retailing
Marketing,A Delphi study of Internet banking
Marketing,Driving marketing outcomes through social media-based customer engagement
Marketing,Auction Fever! How Time Pressure and Social Competition Affect Bidders’ Arousal and Bids in Retail Auctions
Marketing,Enhancing playful customer experience with personalization
Marketing,The store-as-a-brand strategy: The effect of store environment on customer responses
Marketing,FinTech credit: uncovering knowledge base  intellectual structure and research front
Marketing,Shopping  gambling or shambling? Penny auctions
Marketing,Consumer Affective Reactions to Product Problems When the Timing of Warranty Expiration Varies
Marketing,Alliance portfolios and joint R&amp;D project performance
Marketing,Revenge buying after the lockdown: Based on the SOR framework and TPB model
Marketing,The £15 Million Journey
Marketing,Perceived design affordance of new products: Scale development and validation
Marketing,You follow fitness influencers on YouTube. But do you actually exercise? How parasocial relationships  and watching fitness influencers  relate to intentions to exercise
Marketing,Toward an understanding of industry commoditization: Its nature and role in evolving marketing competition
Marketing,Effects of loyalty program rewards on store loyalty
Marketing,Cross-border acquisitions and the performance of Chinese publicly listed companies
Marketing,A taxonomy of differences between consumers for market segmentation
Marketing,Coexistence of sustainability and growth in different economies
Marketing,An extension of the marriage metaphor in buyer–seller relationships: An exploration of individual level process dynamics
Marketing,Should SMEs diversify their global destinations? The role of market insights and digital transformation
Marketing,The gamification of trust: the case of China’s “social credit”
Marketing,Industrial buying behavior: Aviation fuel contracts
Marketing,Culture and Health Persuasion: Differences between Koreans and Americans
Marketing,How cannibalistic is the Internet channel? A study of the newspaper industry in the United Kingdom and The Netherlands
Marketing,First foreign grocery retailer enters the Finnish market—a stakeholder model
Marketing,Sales channel integration after mergers and acquisitions: A methodological approach for avoiding common pitfalls
Marketing,Frameworks of strategic marketing information needs
Marketing,Comparing consumer innovativeness and ethnocentrism of young-adult consumers
Marketing,Bank Patronage Factors of Muslim and Non‐Muslim Customers
Marketing,Do companions really enhance shopping? Assessing social lift over forms of shopper value in Mexico
Marketing,How to say “no”: Conviction and identity attributions in persuasive refusal
Marketing,It's not there  I love it! How relevance to objective needs of an unavailable item impacts emotions  store image  and behavior
Marketing,The new journal ranking is out — And industrial marketing management continues to progress
Marketing,Sales training in Malaysia
Marketing,How power distance belief  self-construal  and relationship norms impact conspicuous consumption
Marketing,How to gain from international R&amp;D alliances? A mutual dependence logic
Marketing,Institutions and business networks: A comparative analysis of the Chinese  Russian  and West European markets
Marketing,Benchmarking market orientation of banks in transitional markets
Marketing,The impact of fraud prevention on bank‐customer relationships
Marketing,Organizing and integrating marketing and purchasing in business markets: An introduction to the special issue  issues and implications
Marketing,Special Issue on Tourism and Quality-of-Life Issues
Marketing,The impact of retailer stockouts on whether  how much  and what to buy
Marketing,Tourism value VS barriers to booking trips online
Marketing,Multi-sided marketplaces and the transformation of retail: A service systems perspective
Marketing,Influencer marketing within business-to-business organisations
Marketing,Entrepreneurial strategy-making  corporate entrepreneurship preparedness and entrepreneurial sales actions: Improving B2B sales performance
Marketing,Drivers of consumer acceptance of new packaged goods: An investigation across products and countries
Marketing,Influencing R&amp;D/marketing integration and the use of market information by R&amp;D managers: intended and unintended effects of managerial actions
Marketing,The Price of Power: How Firm’s Market Power Affects Perceived Fairness of Price Increases
Marketing,IMP and service-dominant logic: Divergence  convergence and development
Marketing,Understanding consumer demand for non-deceptive pirated brands
Marketing,Special Issue Reviewer Acknowledgment
Marketing,Entrepreneurial marketing management
Marketing,Store satisfaction and store loyalty: The moderating role of store atmosphere
Marketing,Capability management control and salesperson turnover: A double-edged sword in a product complexity scenario
Marketing,An analysis of business behavior and performance in a laboratory experiment
Marketing,Business-to-Business Selling Determinants of Quality
Marketing,Institutions and business networks: A comparative analysis of the Chinese  Russian  and West European markets
Marketing,Country-of-Origin Premiums for Retailers in International Trades: Evidence from eBay's International Markets
Marketing,Cross-Channel Effects of Price Promotions: An Empirical Analysis of the Multi-Channel Grocery Retail Sector
Marketing,Metaverse is not my cup of tea! An investigation into how personality traits shape metaverse usage intentions
Marketing,How do creative genres emerge? The case of the Australian wine industry
Marketing,Negotiating successfully in cross-cultural situations
Marketing,The dark side of rent-seeking: The impact of rent-seeking on earnings management
Marketing,An empirical comparison of two brand personality scales: Evidence from India
Marketing,Costs  margins and competition. Causes of structural change in retailing
Marketing,The impact of time on the strategy–performance relationship
Marketing,Author index to volume 10
Marketing,Unravelling the black box between coopetition and firms' sustainability performance
Marketing,The market value for product attribute improvements under price personalization
Marketing,Industry
Marketing,The value of idiosyncratic functional forms in conjoint analysis
Marketing,Reaping relational rewards from corporate social responsibility: The role of competitive positioning
Marketing,Culturally diverse teams and inter-organizational knowledge sharing behavior: The role of perceived morality and relationship orientation
Marketing,Show products or show people: an eye-tracking study of visual branding strategy on Instagram
Marketing,Drown or Blossom? The Impact of Perceived Chronic Time Pressure on Retail Salespeople's Performance and Customer–Salesperson Relationships
Marketing,The impact of formal control and guanxi on task conflict in outsourcing relationships in China
Marketing,A diagnostic study of sales managers' efficiency
Marketing,Applying the envelope curve to technological forecasting and long range planning: The evolution of the laser
Marketing,The relationship between coopetition strategies and company performance under different levels of competitive intensity  market dynamism  and technological turbulence
Marketing,Determinants of customers’ intentions towards environmentally sustainable banking: Testing the structural model
Marketing,The effects of management inertia on the supply chain performance of produce-to-stock firms
Marketing,The impact of digital transformation on the retailing value chain
Marketing,Governing interfirm knowledge transfer in the Chinese market: The interplay of formal and informal mechanisms
Marketing,The effect of horizontal alliances on firm productivity and profitability: evidence from the global airline industry
Marketing,Product and relationship quality influence on customer commitment and loyalty in B2B manufacturing relationships
Marketing,Fluent contextual image backgrounds enhance mental imagery and evaluations of experience products
Marketing,How Bank Loan Officers Evaluate Persons Applying for Credit
Marketing,Are B2B data breaches concerning? Consequences of buyer's or firm's data loss on buyer and supplier related outcomes
Marketing,Shippers' transportation choice processes under deregulation
Marketing,Technology readiness  perceived ubiquity and M-commerce adoption
Marketing,The use of marketing research and intelligence in strategic planning: key issues and future trends
Marketing,Collective job crafting and team service recovery performance: a moderated mediation mechanism
Marketing,An Objective Technique for Loan Officer Evaluation
Marketing,Product placement in Bollywood movies
Marketing,Retailer Credit Cards: A Competitive Threat
Marketing,Shopping value and patronage: when satisfaction and crowding count
Marketing,Measuring the role of factors on website effectiveness using vector autoregressive model
Marketing,Special issue on psychological and behavioral principles related to web design and conversion
Marketing,Consumer brand engagement on social media in the COVID-19 pandemic: the roles of country-of-origin and consumer animosity
Marketing,Factors affecting current users’ attitude towards e-auctions in China: An extended TAM study
Marketing,Efficiency and exports: Evidence from Southern European companies
Marketing,A mechanism for aggregating association network data: An application to brand concept maps
Marketing,Selection and implementation of processing strategies in consumer evaluative judgment and choice
Marketing,Charitable maximizers: The impact of the maximizing mindset on donations to human recipients
Marketing,The role of satisfaction on customer reuse to airline services: An application of Big Data approaches
Marketing,Women in the business-to-business salesforce: Some differences in performance factors
Marketing,Collective market shaping by competitors and its contribution to market resilience
Marketing,Ethnic minority consumers reactions to advertisements featuring members of other minority groups
Marketing,Self-diminishing effects of awe on consumer forgiveness in service encounters
Marketing,The effect of matching promotion type with purchase type on green consumption
Marketing,The Dilemma of Pull and Push-Price Promotions☆
Marketing,Outsourcing: is the social exchange theory still relevant in developing countries?
Marketing,Mindfulness' effects on undergraduates' perception of self-knowledge and stress levels
Marketing,‘I'm like you  and I like what you like’ sustainable food purchase influenced by vloggers: A moderated serial-mediation model
Marketing,Business ties  political ties  and innovation performance in Chinese industrial firms: The role of entrepreneurial orientation and environmental dynamism
Marketing,Institutional environment and Business Groups' resilience in Brazil
Marketing,If looks could sell: Moderation and mediation of the attractiveness effect on salesperson performance
Marketing,Differentiating goods and services retailing using form and possession utilities
Marketing,A general theory of business marketing: R-A theory  Alderson  the ISBM framework  and the IMP theoretical structure
Marketing,Learning process in new product development teams and effects on product success: A socio-cognitive perspective
Marketing,The effect of COVID-19 on consumer shopping behaviour: Generational cohort perspective
Marketing,Consumer response to price changes in higher-priced brands
Marketing,Managing word of mouth communication: empirical evidence from India
Marketing,Barriers of food delivery applications: A perspective from innovation resistance theory using mixed method
Marketing,The effects of social media brand personality on brand loyalty in the Latvian banking industry
Marketing,Website performance and behavioral consequences: A formative measurement approach
Marketing,New emphases in product planning and strategy development
Marketing,Exploring the impact of the physical conditions of mannequin displays on mental simulation: An embodied cognition theory perspective
Marketing,Motives behind retailers’ post-entry expansion - Evidence from the Chinese luxury fashion market
Marketing,Consumer privacy and the future of data-based innovation and marketing
Marketing,An empirically derived taxonomy of retailer pricing and promotion strategies
Marketing,Chronological cues and consumers’ preference for mere newness
Marketing,Understanding customer participation in CSR activities: The impact of perceptions of CSR  affective commitment  brand equity  and corporate reputation
Marketing,A comparison of online and offline consumer behaviour: An empirical study on a cinema shopping context
Marketing,Psychological ownership and disownership in reward-based crowdfunding
Marketing,The effects of constrained mobile coupons in the mobile channel
Marketing,Mining the metaphor of market driving to propel productive research
Marketing,Exploring the elements of consumer nostalgia in retailing: Evidence from a content analysis of retailer collages
Marketing,Quality Issues in Banking: A Conceptual Approach
Marketing,A test of the effects of retail store rating context on the stability of alternative multientity scaling methods
Marketing,A review of choice-based conjoint software: CBC and MINT
Marketing,Treat me well and I may leave you kindly: A configurational approach to a buyer's relationship exit strategy
Marketing,Complementor competitive advantage: A framework for strategic decisions
Marketing,The determinants of Women's redemption of geo-targeted m-coupons
Marketing,Reading between the lines: untwining online user-generated content using sentiment analysis
Marketing,A multi-level investigation of international marketing projects: The roles of experiential knowledge and creativity on performance
Marketing,The reference price effect of historical price lists in online auctions
Marketing,Find me here: share store information through check-in
Marketing,Service quality and behavioural intentions in broadband services selection
Marketing,The theory of planned behaviour and student banking in Australia
Marketing,Asymmetric Perception of Sparse Shelves in Retail Displays
Marketing,B2B and internal relationships and curative international marketing: A polish case study
Marketing,Observation of other's preferential treatment as a constructive catalyst for improved repatronize intentions
Marketing,Using rich media to motivate fair-trade purchase
Marketing,An implicit product theory approach to consumers' inferential judgments about products
Marketing,Price leadership in the paper industry
Marketing,The power of an installed base to combat lifecycle decline: The case of video games
Marketing,The influence of in-store lighting on consumers' examination of merchandise in a wine store
Marketing,The nature of satisfaction: An updated examination and analysis
Marketing,Consequences of Value in Retail Markets
Marketing,Achieving an advantage with countertrade
Marketing,The time vs. money effect. A conceptual replication
Marketing,How to evaluate innovative ideas and concepts at the front-end?
Marketing,Why do people purchase from food delivery apps? A consumer value perspective
Marketing,Journal of Retailing  Volume 77  2001
Marketing,Market entry in Japan barriers  problems and strategies
Marketing,Asymmetrical deployment of specific assets and contractual safeguarding in industrial purchasing relationships
Marketing,Predicting bankruptcy in the retail sector: an examination of the validity of key measures of performance
Marketing,Continuous techno-training and business-to-business salesperson success: How boosting techno-efficacy enhances sales effort and performance
Marketing,A new relationship marketing model and its application in the affinity credit card market
Marketing,Marketing strategy implementation impediments and remedies: A multi-level theoretical framework within the sales-marketing interface
Marketing,Chinese puzzles and paradoxes: conducting business research in China
Marketing,Service quality in the banking sector in an emerging economy: a consumer survey
Marketing,Exploring the use of content analysis methodology in consumer research
Marketing,Personality and travel intentions during and after the COVID-19 pandemic: An artificial neural network (ANN) approach
Marketing,The managerial relevance of marketing science: Properties and genesis
Marketing,Speculative behavior of foreign exchange rates during the current float
Marketing,Some human problems in industrial sales forecasting
Marketing,Analysis of security and privacy issues of information management of big data in B2B based healthcare systems
Marketing,Special Issue on The Past  Present and Future of Interactive Marketing
Marketing,Extracting brand information from social networks: Integrating image  text  and social tagging data
Marketing,Age-related cues in retail services advertising: Their effects on younger consumers
Marketing,Author index to volume 11
Marketing,Every ending is a new beginning: Poignancy increases consumer preferences for self-made products
Marketing,Selecting overseas markets and entry modes: two decision processes or one?
Marketing,An empirical investigation of director selection in movie preproduction: A two-sided matching approach
Marketing,Suppliers' roles in category management: A study of supplier–retailer relationships in Finland and Sweden
Marketing,Fairness asymmetry  changes in mutual trust  and supplier performance in buyer-supplier exchanges in China: A dyadic view
Marketing,Making obsolescence obsolete: Execution of digital transformation in a high-tech manufacturing SME
Marketing,Customer Participation in Virtual Communities for Local High Streets
Marketing,Efficient replenishment in the distribution channel
Marketing,Economic Censorship and Free Speech: The Circle of Communication between Advertisers  Media  and Consumers
